place_id,description,category
ChIJKSxbicpC1moRx-YUjoCPOEk,My go to spot for lunch at work! There is a large selection in the fridge for a quick bite and well as meals made in the kitchen. The herby falafel bowl is a must have and a personal favourite! The staff are always friendly and the service is very quick. | The coffee is fabulous and hot. My order was not communicated to the kitchen. I waited ten minutes and the lady who served me noticed and followed up. She apologised and offered me a complimentary sweet while I waited. The hot pastrami is not at all hot but it is a tasty roll. In almost a happy camper but attention to details is everything.,restaurant_english_clean_desc
ChIJKcqtDMpC1moRvufarBFIlqA,"Breakfast, sandwiches & burgers offered in a long, modern room with counter seating.",restaurant_english_clean_desc
ChIJMyxbicpC1moR0cLxO8kuiP8,"Tetsujin Korean BBQ is a great spot for a meal, though it can be a bit tricky to find at first. The restaurant offers a wide variety of meats, including high-quality wagyu beef that was especially impressive. The service was friendly and attentive, making the dining experience even more enjoyable. Overall, it’s a nice place to enjoy delicious Korean BBQ with good selection and excellent service. Highly recommended! | The meat is of great quality and the food is delicious. The prices are reasonable, so you can order plenty to enjoy. The sushi is also fresh and high-quality",restaurant_english_clean_desc
ChIJB1sDb8pC1moRJ2XOICzTbew,"Steaming bowls of traditional pho served in a bustling, utilitarian room with mirrored walls.",restaurant_english_clean_desc
ChIJc-7BSMhC1moRJadN_SH7-PM,"Refined hotel featuring polished suites, a high-end restaurant and an indoor/outdoor pool.",restaurant_english_clean_desc
ChIJ5XpydclC1moR7UUgWI3KRTI,"Sushi and teppanyaki served in a simple, family-friendly Japanese restaurant popular with groups.",restaurant_english_clean_desc
ChIJr1N1BMlC1moR6aJLe1nHgPQ,"Cantonese meals in a sprawling, red-carpeted restaurant with panels of Chinese art lining the walls.",restaurant_english_clean_desc
ChIJ06dOEslC1moR5wrZnqexW94,Lively restaurant offering Chinese staples in basic setting with tablecloths and red feature wall.,restaurant_english_clean_desc
ChIJ7VyEt8hC1moRRen6QKnTgoo,"Vibrant restaurant & bar with funky, disco-style decor dishing up Asian-style street eats.",restaurant_english_clean_desc
ChIJZTDR6shC1moRq3z8gjwyzcg,"Split-level space decorated with murals housing an Italian fine-dining restaurant, a grill & a bar.",restaurant_english_clean_desc
ChIJj5XQHMlC1moRr-au_PgprUY,"Staff in traditional Bavarian dress serve up schnitzels, sausages and steins in a buzzy beer house.",restaurant_english_clean_desc
ChIJ11WChshC1moRVVoJ51HvoK4,"Chargrilled cuts with matched local wines, in a classy restaurant with mezzanine and high ceilings.",restaurant_english_clean_desc
ChIJuWCNdMlC1moRccHRhxqIN7Y,"Grilled meat, seafood & snacks, plus a vast sake list, in a Japanese-style room with paper screens.",restaurant_english_clean_desc
ChIJgUj6JclC1moRK3chV0S388M,"Pan-Asian dishes in a former textile factory with low-lighting, fabric wall art and a cocktail bar.",restaurant_english_clean_desc
ChIJEedY_chC1moRJXYIf7bpi1w,Dumplings & other staples served in a chic restaurant incorporating Chinese motifs.,restaurant_english_clean_desc
ChIJQU1Ac8lC1moRFcuL51IWEfc,Elegant Asian restaurant in busy cultural hub serving dim sum in a simple and stylish setting.,restaurant_english_clean_desc
ChIJ11L1vslC1moRY2bUl0toqJ4,"Mexican standards like enchiladas and tacos, plus margaritas, dished up in a casual, enduring chain.",restaurant_english_clean_desc
ChIJ-7pLvshC1moRWHbU4T32oaU,"Modern Italian food in an elegant restaurant with tablecloths, leather banquettes and mood lighting.",restaurant_english_clean_desc
ChIJwzeo78hC1moRW61GRBlZJ0w,"Warm, traditional English pub for bangers and mash, Guinness on tap, and live music on weekends.",restaurant_english_clean_desc
ChIJlfjfvchC1moRCNO0EIFZ1vo,"Established, family-run Italian coffeehouse with a changing daily menu and counter seating.",restaurant_english_clean_desc
ChIJJQg1FMlC1moR09CgE7WO9Ns,Bustling and basic restaurant for spicy and regular Sichuanese dishes and specialty cumin pork ribs.,restaurant_english_clean_desc
ChIJrSIyAMlC1moRiGrpp18Yta8,Classic bistro meals and all-day breakfast on the weekends in a modern pub with live sports on TV.,restaurant_english_clean_desc
ChIJAXQwJclC1moR6-UVXc8KYqQ,"Down-to-earth destination featuring beer, wine & bar bites, plus happy hour, gaming & TV sports.",restaurant_english_clean_desc
ChIJH6U1mMhC1moR3NZKo1n_rzQ,"Eclectic restaurant offering Italian specialties, cocktails & wines, plus gluten-free options.",restaurant_english_clean_desc
ChIJ-dMSJsZC1moRBR6RQKxblbI,Intimate place for tapas and fine wine in a vibrant room with bar seating and red leather couches.,restaurant_english_clean_desc
ChIJn4XNHslC1moR6TOEXn-ggyQ,"Cheery Chinese dumpling house over 2 levels, with standard mains, pink walls and basic seating.",restaurant_english_clean_desc
ChIJxbZOsshC1moR7thhGoEJ11s,Sophisticated Modern Australian restaurant with a seasonal menu and a vast wine list.,restaurant_english_clean_desc
ChIJf2svx8lC1moRuzJmOMcPHHQ,"Classy, intimate Italian restaurant with marble-top bar, tablecloths, and many wines by the glass.",restaurant_english_clean_desc
ChIJMSsO6clC1moRs-oGzpxp97o,"Industrial-chic hotel featuring modern rooms & hip dining options, as well as a rooftop bar.",restaurant_english_clean_desc
ChIJ0y4DB8ZC1moRRnezTs9hzKs,"Pizzas and hearty pub food in a lively sports bar with 2 big screens, plasma TVs and outdoor seats.",restaurant_english_clean_desc
ChIJme6hTM9C1moRFG6RpYqZL0c,"Spacious rustic-chic Southeast Asian restaurant with cocktail bar, communal tables and share dishes.",restaurant_english_clean_desc
ChIJVUlb_MVC1moRE8udyJ-mVCc,Modern European dishes and a nose-to-tail menu in a laid-back dining room with Bentwood chairs.,restaurant_english_clean_desc
ChIJoS8hIMZC1moRo_A2fOZBqI8,"Argentinian menu focused on chargrills, in an eclectic space with high ceilings and hung cow hides.",restaurant_english_clean_desc
ChIJVUlb_MVC1moRGtUfRpCN1Y0,"Upmarket late-night wine bar with stylish couches, chesterfields and a large circular bay window.",restaurant_english_clean_desc
ChIJRcbPosdC1moRarB0BT57qLo,High tea and seasonal farm-to-fork lunches offered on weekdays in an elegant wood-panelled hall.,restaurant_english_clean_desc
ChIJoZLSJMZC1moRqWQOMA91M5c,"French-inspired mains and a buffet in a warm, modern restaurant with a homey feel, inside a hotel.",restaurant_english_clean_desc
ChIJ56e2iMhC1moRLukuJUxAsq8,"Colourful boutique bar & eatery offering Modern Australian & Thai food, along with breakfast.",restaurant_english_clean_desc
ChIJIT_tH8ZC1moRz1xDKzjp4aM,"Such a cool spot for a casual catch-up and shared pizza. Head through to the back area for the booths and great music. Super friendly staff. Very good value too. | We got there at 5pm for a pre ""Annie"" musical dinner. This place is an amazing surprise. Street front looks like a tiny takeaway. Go through the mysterious black curtain, wow, it's perfect. Small booths, dim lighting and the MOST PERFECT pizza I have ever had. We shared a half and half/seafood and peperoni. It's alot of food for two people, we didn't finish it, but it was brilliant. Will definitely come back. Thank you!",restaurant_english_clean_desc
ChIJk_-zr7RC1moRYhobOmYDQNY,"Hip, contemporary American spot dishing slow-cooked BBQ ribs & brisket, plus craft beer & cocktails.",restaurant_english_clean_desc
ChIJu0EsJsZC1moRZPyANujcIas,Industrial-chic Italian restaurant with chefs crafting handmade pasta and pizza in an open kitchen.,restaurant_english_clean_desc
ChIJHVs9FllD1moRM0817WiLGzo,"Visited for the weekend high tea which included a three tier stand, scones, and a buffet of desserts, cheese selection, chocolate fountain and mini sausage rolls and pies. The three tier stand took about 20 minutes to prepare so it was nice to be able to start with some hot food from the buffet section. From the three tier stand, the cucumber and cream cheese finger sandwich was one of the better ones I had; the smoked salmon and cream cheese cannoli was the best one out of the savouries, and the pistachio tart and the cappuccino entremet were both decadent and very tasty. The scone service came midway into high tea so you can enjoy them warm, and they came back later with another round which was nice but I decided to reserve some space to try some of the desserts from the buffet. Surprisingly the quality of the sweets from the buffet were just as good as the ones from the high tea menu, especially the pineapple tart, citrus pavlova and the earl grey & bergamot slice. Drinks were extensive with a glass of sparkling wine included, and free flow coffee, hot chocolate and twelve types of loose leaf teas to choose from. Teas were high quality; had the Windsor's Afternoon Blend which has a deep well-rounded flavour without the harsh bitterness, and the Lapsang Souchong which has an intense but pleasant smoky aroma. Overall enjoyed the high tea experience, especially the desserts and teas; atmosphere was classy and elegant and the staffs were professional and welcoming though it was a little difficult to order drinks but understandable because of how busy it was. The additional $20 for the weekend high tea which includes the buffet was definitely worth it if you have a big appetite. | Great staff and atmosphere. Attended high tea for a seminar. They were able to adapt the food to my allergies. The tea selection was amazing. Has windsor arvo tea, Lapsang soucheong and Berry green. Only issue was some of the dessert was flavourless like the red velvet cake and the egg Watercress sandwich wasn't nice either. Macaroons were to die for, as was the coffee entreme. Had a great time.",restaurant_english_clean_desc
ChIJvfU_mCpD1moRujoDYOY32ig,"Tried their Fillet O Fish and it was absolutely delicious,fresh, perfectly made, and full of flavor! The quality really surprised me in the best way. The service was friendly and quick, and perfect for a casual meal .Definitely going back to try more items from their menu. | I tried the friee chicken sandwich here and this reminded me of how good Melbourne's sandwich game really is. The sandwich isn't that big and the chicken was a little small, but the flavours were phenomenal. Everything works well together. The chicken's flavour just hits right.",restaurant_english_clean_desc
ChIJR1OrH8ZC1moRixhTkKsUwi8,"No-frills Italian mains, homemade gnocchi, and house wine served in a basic setting with homey vibe.",restaurant_english_clean_desc
ChIJ43IaCDdD1moRAunNiIeaCQ8,"My wife and I had a fantastic meal at this restaurant. The food was beautiful, authentic, and super fresh (many of the produce items are from their own gardens). The staff were super friendly and we had some great conversations. We are definitely coming back again when we come back to Melbourne. We only wish we could come more often, as this restaurant will be a regular for us. | The Mog Champ sends his regards. It's like a more affordable version of Omakase but with a different concept. At Temaki, the main course ingredients are provided and it's up to you to make the hand rolls themselves with the complimentary seaweed and rice. The service was professional and friendly, it's compact inside so it caters towards smaller groups. Overall, the concept of rolling it yourself was both fascinating and fun. This place is fancy in its own way and would love to try a different seasonal menu some day again. At the end, they also provided us with gifts to take home as well which was a friendly gesture. Thanks for the dinner, Temaki. Mogliest Regards, Your Mog Champ",restaurant_english_clean_desc
ChIJjyqcU2ZD1moRfs2zPVJGHKM,"One of my favourite Japanese places in the CBD. Bento boxes - Priced at around ~$25, I highly recommend. Each element is delicious in its own way and they combine to deliver a great balance of flavours. Comes with a miso soup. Onigiri - Priced at $5, they’re tasty but they’re a bit more finicky to eat compared to sushi. No card surcharge. Seating is tight and best suited for just 2 people. | Located on Little Collins Street is a cozy, intimate Japanese spot that serves traditional riceballs that are made fresh throughout the day. Would be good to pop in to grab some on the go. Staff were very lovely + understanding and they offer a range of Gluten Free options thst customers with Celiac Disease or cannot tolerate gluten can enjoy as well. These are clearly marked and they have other home styled GF friendly Japanese dishes that were created by their chef available as well. Liked that they have a generous amount of topping in each riceball, crispy/crunchy potato pancakes, karaage and pickles. Also their ceramic dishes were very cute as well (so cool that they make them themselves!). They do have sake and other alcoholic drinks available as well. Tofu donuts were nice as well, couldn’t really taste the tofu but flavours we tried were good and had a light texture (would be great with coffee/matcha!).",restaurant_english_clean_desc
ChIJwXa7VttD1moRLvOlu6nWOks,"Love having this spot around. The onigiri are a little pricey compared to similar versions but I like the diverse range of fillings. The salmon and the veg are two of my favourites. The matcha and coffee donuts are also worth a try. They have a nice texture and a very subtle sweetness. | GUYS THESE DONUTS ARE AMAZING prepare to eat at least three of them. ""Made with Tofu"" they're soft and delicious and similar but somehow different (and in my opinion quite a bit better) than an American donut. Interesting, subtle, gently flavoursome and easy to eat. And warm on a chilly day. ***** Cafe has extremely lovely polite friendly staff. And great onigiri (I tried the beef - it was awesome) $5 each onigiri, reflects accurately this historical location on Collins Street, and quality food so worth visiting and buying 2. With actual chef quality flavours inside, the seaweed hold the rice together extremely well. May 2025 - delightful jazz music playing - outdoor seating only",restaurant_english_clean_desc
ChIJl2FeJzpD1moR_955lStBxbo,"Oysters, sashimi & modern Japanese eats pair with sake & plum wine in a sleek ambiance.",restaurant_english_clean_desc
ChIJDfVTPHtD1moRPSIftKdLUaM,"Trendy restaurant chain offering made-to-order schnitzels served in a bun, in a salad or with chips.",restaurant_english_clean_desc
ChIJA3mwWMhC1moR7IV8TlY6WCg,"Crisp 45 Collins Street is a standout destination known for its stylish and modern appeal. I opted for the Slow Cooked Spiced Chicken which was excellent. Located in a prime spot, this venue excels in offering a premium experience with its sophisticated atmosphere and top-notch service. The interior design is sleek and contemporary, creating a comfortable yet elegant environment. Whether you’re visiting for a business meeting, a social event, or simply to enjoy the ambiance, the space is well-suited for a variety of occasions. The staff are attentive and professional, ensuring that every guest feels well taken care of. Crisp 45 Collins Street delivers on both aesthetic and functional fronts, making it a notable choice for those seeking a refined experience in a central location. | Oh man I wish I read reviews before coming here the bowls are joke!!! Felafel bowl with no felafel!!! Waste",restaurant_english_clean_desc
ChIJQwd52MdC1moRFvHrKJ-qOq8,"I’ve been coming to this place for lunch for a long time. start back to office work, I’ve started ordering from Asian Pavilion again. The lunch boxes have new packaging — much better than before! The food is now nicely separated, not all mixed together like it used to be. The fried calamari is especially tasty — just make sure to eat it right away. I tried taking it home for dinner once, and it wasn’t as fresh after a few hours. | Good choice for busy lunch time. I especially enjoyed the curry vegetables and fried calamari. The vegetables were fresh—not the usual frozen kind—and the calamari was also very crispy during the lunch time. Good price for lunch meal with drink.",restaurant_english_clean_desc
ChIJRbLKBcZC1moRgi6S3xR2pA4,"EXP by Sunda It is pop-up restaurant, and as far as I know they will open until in March (only month left) I highly recommend you go there ASAP and try their best Asian flavors dishes | Wow. Congratulations Sunda on the opening of Summer EXP. Delicious food and attentive wait staff made it a grand experience. Lovvvve that there is sour beers on the menu, cuts through the heat of the egg noodles and the asparagus. Do order the octopus as a starter and save room for the tiramisu for dessert!",restaurant_english_clean_desc
ChIJG-huZqpD1moReUZmm18Pei4,"Excellent experience, food and drinks. Great recommendations and service, all expectations were exceeded. Steak came with a variety of mustards which was a great addition that really brought out different flavours in the meat. | If I could rate this restaurant 6 stars out 5 I would. The service was amazing The food was next level amazing The atmosphere was spectacular. Your tastebuds will thank you for weeks, I highly recommend this restaurant and we can't wait to go back.",restaurant_english_clean_desc
ChIJ62YP0MdC1moRl_FivKToz7s,"A mediocre Sofitel offering compared to its cousins in other Australian cities. The staff are lovely but they are severely understaffed especially during the drinks and canapé sitting. We were one of the first to arrive and it was over 30 minutes before we had a drink in hand. The food offering was very basic epitomised by carrot and cucumber sticks | Easily the best Club experience we have encountered. The young waitresses are exceptional & make you feel like a family member. In addition to a breakfast buffet, guests can also enjoy afternoon tea, evening canapés & ‘sweet dreams’ before close. Our afternoon tea (Le Goûter) featured a delightful selection of cakes, macarons, croissants & baguette. They also had a delicious selection of chocolates. Canapés featured samosas, dumplings, croquettes, and a buffet with charcuterie, cheese boards & antipasto. Their drinks feature some local tipples and familiar international brands. This was truly the highlight of our stay.",restaurant_english_clean_desc
ChIJG86Ln8hC1moRgRVvzbmC6iI,"Cutting-edge cafe/bar with panoramic views, serving eclectic, modern food and inventive cocktails.",restaurant_english_clean_desc
ChIJV6hLGEhD1moRsJOfJtGAll4,"We originally planned to go to Hector’s for sandwiches, but to our surprise, this store was still open after we finished our heavy lunch. I know Melbourne is famous for its matcha, but honestly, this is the best matcha I’ve ever had in the city — and I’ve tried plenty of matcha cafés around! You MUST try their matcha cookie , it’s sweet, but pairs perfectly with coffee. Simply amazing! We were served by Ray, thanks for his fun and friendly energy, make my day shines ! | I just loved the vibes here. Staff was very friendly and welcoming. I saw this spot when I was visiting Hector’s Deli upon my last visit to Melbourne and was always curious to try their sandwiches. Today I was finally able to! So glad I finally got to try it out. I saw another customer having a kaya toast set(?) which looked amazing! Maybe I’ll have to try that next time I’m visiting Melbourne. Aside from sandwiches, they also have amazing looking desserts, cookies & matcha drinks.",restaurant_english_clean_desc
ChIJo5cIVQBD1moRT-ez10QU27Q,"Maison Batard @maison_batard - Asortiment de Pain 🥖🧈$15.5 - Lobster Omelette🦞🍳 $49.5 - Tartare de Thon et Avocat 🥑🐟$39.5 - Rib Eye Steak 600g 🥩 $95.5 ⭐️ - Purée de Pommes de ferre 🥔$18.5 - Gâteau au Chocolat 🍰 $24.5 ⭐️ - Domaine des Aubuisieres Cuvee de Silex Vouvray 🍷 - 2018 Domaine de Brondeau Lala🍷 Birthday Dinner #6 I have heard mixed reviews of Maison Bâtard so I decided to experience it for myself and I was pleasantly surprised. We started with the sourdough and baguette, served fresh and warm. The lobster omelette was rich and flavourful thanks to the crayfish bisque, although the omelette itself was slightly overcooked. The spicy tuna tartare was fresh with a nice kick, a bit of crunch would have elevated the texture. The standout was the rib eye steak, perfectly cooked and well seasoned. The peppercorn sauce was my favourite. I also enjoyed the chocolate cake. It was decadent yet not overly rich or sweet. Maison Bâtard has an extensive wine list with many old and rare bottles. I appreciated the thoughtfully curated short list for those who might find the full selection a little overwhelming. The interior is stunning and the service was friendly. It’s definitely on the pricey side and I’d expect a bit more for this price point. But you’re paying for the whole experience — the food, wine and atmosphere combined. | Maison Bâtard offers a truly magnificent view — every angle is picture-perfect and beautifully designed. The ambience is elegant and relaxing. The food was decent, though not particularly outstanding. Service was mixed — one waiter was exceptionally attentive and polite, while another came across a little abrupt when handling payment. Overall, it’s a lovely venue to enjoy the scenery and atmosphere, but the overall experience was just average.",restaurant_english_clean_desc
ChIJVePWBsZC1moR67oZW_aUbmA,Daily specials & all-day diner standards with an international twist offered in a funky space.,restaurant_english_clean_desc
ChIJj9MMdzRd1moRUezz0fDqUEk,"We tried spinach feta gozleme & banana strawberry nutella gozleme & mocha for AUD44. Friendly staff. No surcharge for card payment. | Stopped in for breakfast numbers 4 & 5, I think. Not bad, nothing fancy, could have had a bit more flavour. The service was excellent. Overall it was good for $40.",restaurant_english_clean_desc
ChIJY35yAUpd1moRUntgHynaGgA,"Stylish restaurant in the Radisson Hotel, offering breakfast/lunch buffet and seasonal evening menu.",restaurant_english_clean_desc
ChIJ4-rH06Rd1moRhUxq1mqNE4g,"Really tasty spot in the city! Loved the pork katsu and unagi don, the beef brisket tomato pot was super comforting, and the gyutan don was on point. Drinks were refreshing too (the strawberry + Sprite + Yakult mix is a must-try). Chill vibes and nice staff — will definitely come back. | Delicious Japanese food, plenty of options for everyone, amazing atmosphere resembling a real restaurant in the heart of Tokyo. I have many dietary restrictions, but what I liked is that the staff was very flexible to modify my bento box and target my preferences. The only issue was that I went to eat with my 3 other friends, and while the three of us got food at a similar time, my other friend had to wait 10 more minutes for his meal. That could have been avoided with better planning in the kitchen/front desk.",restaurant_english_clean_desc
ChIJfWhoEGld1moRM6qFMbNElJg,"The Mog Champ sends his regards. Came here for lunch recently for the first time and it was amazing. They have a good lunchtime special where it's slightly cheaper and we got the beef bulgogi and KFC babsangs. Was it worth it? Definitely! It's a very low-profile Korean restaurant with minamalistic decorations run by a couple. I would love to try their other options next time, highly recommended to any Korean food lovers! Thanks for the lunch both! Mogliest Regards, Your Mog Champ | Highly recommend!!! Have been a couple of times and just can’t get enough of it!🤩 The sets are perfect for a nutritious lunch or dinner for one, and there are shared dishes too. Tofu soup with seafood 🍤 & Kimchi soup with pork bone 🍖 are both delicious! the side dishes are really good, especially the cauliflower It’s a small place ran by a Korean couple and they are super nice and welcoming ~~~ Will come back often and support their business 🥰",restaurant_english_clean_desc
ChIJH2YQQK5d1moRuegyWAVULHA,"I recently visited Don Don, and it was actually my first time eating Japanese food (beyond sushi)—and I absolutely loved it! The menu had a great variety: fried dishes, chicken, rice, and more. The portions were generous, and the prices were very affordable for the amount and quality of food we received. We even ordered extra to take away because we enjoyed it so much. One interesting cultural detail for me was that the rice was served without salt. In my Colombian culture, we usually season our rice, so at first it felt a bit unusual. But in the end, it actually worked really well with the rest of the dish—it balanced the flavors nicely and wasn’t unpleasant at all. The restaurant was cozy and comfortable, and we ended up staying there for about three hours, chatting and relaxing with friends. We tried several dishes, and everyone left full and satisfied with both the flavor and the experience. 🔸 In summary: For a first experience with Japanese cuisine, this place was perfect. Delicious food, great value, and a relaxed atmosphere. I’d definitely go back! | Very spacious space inside indeed. Good thing that there is a bar too. I like the mural on the wall. Coming to their menu, I will admit I found it very straightforward. I ordered chicken karage curry and octopus balls (takoyaki). The takoyaki was so delicious and the crispy chicken just tasted better with the curry. Overall, a nice simple dinner.",restaurant_english_clean_desc
