place_id,description,category
ChIJ-R8fAE9d1moR3yFuI2x1z00,"Modern, upscale bites in an industrial-chic former power station with exposed-brick walls.",cafe_brunch_bakery_desc
ChIJ-Y0h5itd1moRjNO5-_4SVVE,"Absolutely amazing coffee! During our stay in Melbourne we visited Code Black Coffee on Spencer Street multiple times and tried the cold brews, several batch brews, and pour overs – every single one was outstanding. The service was consistently 5-star, with staff who are not only friendly but also incredibly knowledgeable and passionate about what they do. Highly recommend to anyone who appreciates quality coffee and great hospitality! | Date of visit: 07/10/2025 Time: 4:08:45PM First time customer here and came in for a quick coffee on my way home from work. The man at the cashier Moses provided exceptional customer service. I asked what milk coffee do you offer and he said full cream only but assured me it’s the best milk to use for a white coffee. He was right. Tasted absolutely fantastic. I noticed he was supportive to the other baristas working behind the bar and making sure everything was under control, which is lovely to see. Great coffee and great vibe. Will definitely be back.",cafe_brunch_bakery_desc
ChIJnwkZOqND1moR8sSB0apJ4_Y,"Contrary to the warm service and the atmosphere of this modern dessert bar, the coldness of the desserts are only contrasted by their lack of complexity in flavour and overbearingness. This is in no fault of the staff. Whilst visually they're beautiful and striking and the texture interesting and varying, the flavour takes all attention from that in such a profoundly negative manner that I was left in awe at the high price tag. I would only return here for the work or date friendly atmosphere, staff, and rather pleasant coffee. | I am not type or person who ate cake often. But I like Reynold and his creation so I went to try. Cakes are nice,fresh(to me compare to few shop that feel frozen and old). I could see each components, it's interesting to see. The taste are good but Im not expert. only one down point for me is a bit pricey. But I understand somehow as they sell for technique and ideas. So It's kind of you eat art piece.",cafe_brunch_bakery_desc
ChIJOfotPd1D1moRKBrT3Juq8fQ,"Classy atmosphere, super friendly staff and delicious food!!! Perfect spot to chill and study during the week! Their Porchetta focaccia is the bomb! The crispy pork belly is next level goodness! In terms of flavour I would say best in melb!!! The chicken Cotoletta too super flavourful!! | A quick stop for coffee and croissant and boy is there pan au chocolat nice and chocolatey. Every single bit. Crispy on the outside, soft on the inside. Good find! Musics a bit loud so not a quiet coffee place. They have sandwiches and salads as well that could be worth a try if the croissants were so good!",cafe_brunch_bakery_desc
ChIJFfuagElD1moRfHn5PWOZDqE,This trendy little cafe and roaster offers a range of affordable sandos and delicious drinks. ,cafe_brunch_bakery_desc
ChIJXxBI8NVd1moRD3rtldCWjGY,"Great spot for fresh banh mi style rolls, coffee, pies, and sweets. There’s a huge variety to choose from all made to order. There’s Vietnamese iced coffee was also great. Everything is very reasonably priced making it the perfect cheap breakfast or lunch spot. Staff were very friendly too. | Cute little bakery, Vietnamese restaurant tucked away down a lane. You might miss it! I got a Vietnamese grilled chicken salad. 16 dollars, super large portion and so tasty! The staff were very friendly",cafe_brunch_bakery_desc
ChIJu8iveCtd1moRf1RMo6LfaZA,"One of the best coffee spots in town! Great atmosphere, friendly staff, and perfectly brewed coffee every time. Highly recommended! | Incredible coffee! Absolutely amazing! Up there with the great coffees of Melbourne! Loved the atmosphere and decor inside, friendly staff, and it was great to see so many gluten free snacks. Recommend! I would return!",cafe_brunch_bakery_desc
ChIJg9OHO7RC1moR8LaOJz3PZok,"Italian cafe known for sweets, serving pizza & housemade pasta in a modern space.",cafe_brunch_bakery_desc
ChIJzRa1FbRC1moR01tSbLByQ8s,"Casual option serving bites such as tacos, pizza & sandwiches, plus coffee, cocktails & beer.",cafe_brunch_bakery_desc
ChIJGTbCqEpd1moRvbLaxevnLtw,"French toast and baked eggs are staples at this compact, rustic-chic breakfast cafe with warm vibe.",cafe_brunch_bakery_desc
ChIJCQNVUbNC1moRvc7o62F_xro,"Easily the best high tea I’ve ever been to. My friend booked me a surprise visit to Collins Coffee House for their Saturday high tea. It was amazing! I can’t wait to come back. The staff were absolutely lovely and very attentive, the venue is stunning, the food was fresh and great portion sizes. Added bonus, a violinist while you enjoyed your tea. | My husband and I celebrated our wedding anniversary with afternoon tea at Collins Coffee House. The historic building and eclectic seating add to the atmosphere and the food was lovely. There was an interesting variety of savouries and sweets even with their gluten free items which I required, and the service was attentive. It was a delightful experience.",cafe_brunch_bakery_desc
ChIJWeak6YBD1moRtfyrERisY4Q,"The most amazing coffee. You have to try the dirty coconut coffee from their Signature Dirty Coffees menu! The staff are also super friendly. My wife had the Morning Bar Coco which she loved and said it wasn't too sweet. | If you are looking for the Melbourne coffee culture, this is the place you have to visit to get the experience. Excellent location in the CBD area, underground atmosphere, and friendly staff. If you want to go out of your comfy zone, the Dirty Coconut coffee is highly recommended!! Enjoy 😉",cafe_brunch_bakery_desc
ChIJT61MWNlD1moRbJAotYDnIGQ,"Finally tried Lune as I’m usually buying from Agathe or South Melbourne bakery. We tried a few and the quality is good, crunchy and soft. Our favourite was the ham and cheese, absolutely delicious. Always wondered about the line every weekend and then we saw how small it is on the inside. Quality might have something to do with it too. They’re expensive but what isn’t these days. Service was excellent. Thank you 🙏 | I was here for at least 3 times over a week during my holidays here in late July. That explains how good the pastry here is. Tasted almost everything that is offered here. Price is on the high side, but the quality made it up. This cafe is a bit small, more suitable for takeaway or a quick bite before you move on. There is road side parking just right in front of the cafe so it is very convenient for those who drives.",cafe_brunch_bakery_desc
ChIJSxIgKrRC1moR16XSMelL-sg,"Amazing stuff. Has these for the first time in Sydney and it's sad that Melbourne doesn't have more locations. The cheesecakes are light fluffy and creaming. Just amazing. The Madeline have the most wonderful honey scent, perfect with a cup of black tea. I also got myself a mango cream crepe, messy to eat so I would recommend sit down and eat it in a bowl with a fork. But it's amazing. None of the desserts are too sweet, just the perfect amount, which is the best compliment for Asian sweets. Definitely give it a try if you are interested in Japanese style sweet. I came at 11:50am and was the first person in line for 12pm opening, worth it seeing the care being put into the making process. | Loved their cheesecake, it’s soft, not too airy or dense, and doesn’t have that eggy taste some cheesecakes do. I also tried their crème brûlée crepe, which was creamy and packed with strawberry filling and two slices of cheesecake inside. Definitely worth trying at least once!",cafe_brunch_bakery_desc
ChIJ25x2xuFd1moRVl-vqCL_ZGo,"We tried their famous Peanut Cream Latte $7.70 – not really our taste 😅 it just tastes like peanut butter! The flavour is unique though — maybe others would enjoy it more. The café is cozy and nicely designed. There’s always a line, but it moves quickly. Might come back to try other flavours next time. | Visiting this cafe has become part of my weekly routine, even though I’ve only ever ordered one drink. The Peanut Creme Latte is so good that I just keep coming back for it! The customer service is great, with staff who are always cheerful and accommodating. It can get quite busy at peak hours, but the queues move quickly. Definitely worth checking out if you’re in the CBD.",cafe_brunch_bakery_desc
ChIJw3ZAzdJD1moRdTHBsWBAcao,"I always go to Maker. The coffee is very consistent and really good. I usually get Batch brews, but I’ve tried latte, flat white, macchiato, long black, and mocha. I prefer getting just batch brew or a regular latte. Always ask for the bean! It’s so interesting reading the description of what you’re drinking | The environment in the store is great! It's very atmospheric to shoot casually! The coffee beans used in the store are also very good. Because my friend didn't have lunch that day, I ordered a tiramisu. I didn't expect it to be a Swiss roll type. Unexpectedly, I found that it was delicious. There were a lot of people in the store, but it didn't affect my chatting with my friends. Moreover, this restaurant is not like other stores that will drive away when they are about to close. Customer, the clerk is very friendly.",cafe_brunch_bakery_desc
ChIJywGq8jRd1moR5nQ1m6DgWEI,"Came across Cafe Belt when I was looking for a good coffee in town, an interesting few choices on the menu, so I tried something new, the Vegeta, coffee with Edememe Milk, it was rich, mildly sweet & very smooth, my friend had a hot chocolate which he said was delicious. I definitely recommend a visit if your from our of town like me, it would be a regular for anyone local. Customer service was great, so friendly & accommodating, thanks for a wonderful experience | A little cafe at the roadside, popular and cozy. kind and friendly staff providing good service. Limited choice for breakfast, only pastries. Ordered an almond croissant and long black large. The long black was unexpectedly good, it had a a fruity smell and taste, not able to taste any outstanding flavor, but already quite amazing that it was without a little bitterness . The almond croissant was full of almond on top, it was slightly crispy outside, but too soft inside, and the sweetness dominated the taste, very little to no butter flavor could be tasted. Total $12.5 cash. Worth coming back for the coffee and cozy environment, for working but may not want to have the pastries.",cafe_brunch_bakery_desc
ChIJWed4TjVd1moRBMXZM1lHTR4,"Artisanal donuts & organic coffee in a snug space with chic, minimalist decor & limited seating.",cafe_brunch_bakery_desc
ChIJjQLxXzVd1moRm6Cg5UkgViI,Craft coffee & creative brunch options in a bustling cafe-bakery with a vintage redbrick facade.,cafe_brunch_bakery_desc
ChIJf4q6nkxd1moRawpiDcr8X34,"One of our new favourite places in Melbourne to enjoy French patisseries. High quality cakes ( full size and minis), slices and beads. There is seating inside to enjoy the food and excellent coffee and other drinks. Best to order wanting to take away. | The Mog Champ sends his regards. Ordered a birthday cake here for a special person two months ago and wanted to leave a positive review! They require a day's notice for an order of one of their amazing cakes. They charged about $5 for the customised message as well. The black forest cake was delicious, they have a nice seating arrangement inside if people wanted to stop by to have a drink and dessert too. Thanks for the fancy cake Le Petit! Mogliest Regards, Your Mog Champ",cafe_brunch_bakery_desc
ChIJHZeEMVdD1moROPT4js9HnXw,"Great coffee, amazing food, and a modern black-and-white space that feels so clean and unique. Staff are super friendly and knowledgeable, explained everything perfectly. Loved the biscuit (not too sweet) and the toast was delicious. Absolutely worth a visit — I’d definitely come back again! | Good coffee in a modern designed cafe. There are some small tables if you need one, otherwise it is pretty much grab and go concept. Very instagram-worthy deco. No queue and coffee is served promptly.",cafe_brunch_bakery_desc
ChIJg1wLO7VC1moRrzObM92WgkU,"Choice coffee, brekkie & bagels in a bright, airy space with eclectic decor & a vintage-chic vibe.",cafe_brunch_bakery_desc
ChIJxRIPiMlC1moRLSuO5kfDqC0,"I have visited Dessert Story quite many times in the past 2 years. My favourite desserts are always the traditional grass jelly with various toppings and the mango sago.😋 The price level is quite reasonable. The staffs are nice and welcoming, though they were usually very busy. If you are from HK / PRC, you can probably speak Cantonese or Putonghua for ordering if you like. | Dessert Story is a reliable fix for late-night cravings in the CBD. The shop glows with pink signage and a wall of illustrated menus, so you can scope out your order before reaching the counter. Seating runs along communal benches and small tables tucked by the windows; it fills quickly after dinner hours but turn-over is fast enough that a spot usually opens within minutes. The menu leans Taiwanese, offering chewy taro balls over silky tofu pudding, grass jelly with red beans, and shaved ice piled high with fresh mango when it is in season. Portion sizes are generous and built for sharing. My go-to mix is the warm ginger syrup bowl topped with sweet potato balls that stay springy to the last spoonful. Drinks cover the bubble-tea basics, with brown sugar milk tea landing rich and perfectly balanced, boba still warm from the pot. Staff keep the line moving with brisk efficiency, calling orders by number and offering containers if you decide to take dessert on the run. Prices sit in that sweet spot between university-budget friendly and dessert-bar indulgent, so trying a couple of different toppings does not sting the wallet. The store stays open well past most cafés, making it a handy final stop after a movie or night class. For colourful comfort sweets, quick service, and a menu that encourages repeat visits, Dessert Story holds its place as a city staple.",cafe_brunch_bakery_desc
ChIJG7NvPrVC1moRsKRHrZ0JnVg,"Breakfasts and light lunches in a trendy, minimalist cafe with white walls and blackboard menus.",cafe_brunch_bakery_desc
ChIJNbbeGhpD1moRYhlJy2LyBRY,"I've visited twice and the desserts are always great. I've previously gotten the Green Tea Chocolate Bingsu to share, which was really nice & aesthetic. Last time I got a combo of strawberry shortcake & an iced tiramisu latte, the cake was delicious & the coffee too, but maybe a regular latte would do the trick for me since I didn't need that much sugar. | You can’t go wrong with Sulbing, especially if you’re craving bingsu! The sweetness is just right, the texture is smooth, and the serving sizes are generous with beautiful presentation. The seating is comfortable, making it a great spot to wind down and satisfy your sweet tooth. Their cake was incredibly soft and delicious too. The only slight letdown was the black sesame latte—it didn’t quite live up to the rest of the experience.",cafe_brunch_bakery_desc
ChIJPw7i7p9D1moRSuTZnGRGtBo,"Thought I'd try this place out since they have 1000s of stores in China and have low calorie americanos. I don't drink Americanos often but these flavored ones were pretty good, tried both the pomelo (you need to like a slightly sour taste) and coconut water. Extra star for the mega bottle which can be reused as a gym bottle. | It‘s my favourite cafe in Shanghai！I can’t believe I can see it in Melbourne！it looks so good and tastes well！",cafe_brunch_bakery_desc
ChIJKZzZHgBD1moRJ4lAT5gtxk8,"I ducked into the Mitchell House Market Lane on a busy morning and walked out grinning. The little corner space has that clean, art deco feel, all light wood, soft lighting and a bar that lets you watch the shots being pulled. Music sits low, grinders purr in the background and the whole room smells like freshly ground beans. It is the kind of place where you relax as soon as your hands wrap around a warm cup. The coffee is the headline and it absolutely delivers. My flat white was balanced and silky, with a chocolate and stone fruit thing happening that lingered without turning bitter. A follow up pour over showed off their lighter roast side, bright and sweet with a citrus lift that stayed clean all the way to the last sip. Milk is textured properly so the first sip matches the last, and if you are into filters, the baristas are happy to talk through what is on the bar and point you to something that suits your mood. Pastries in the cabinet are fresh and not an afterthought, perfect if you want a small bite with your cup. Service is what keeps me coming back. The team is quick, friendly and clearly cares about the details. If there is a line, it moves, and orders land in your hands faster than you expect. Shelves of beans and brewing gear make it easy to take something home, with roast dates and tasting notes that are actually useful. Seating is limited, so plan on takeaway or a quick stand at the bar during the morning rush. Tip: ask for a recommendation, try the batch if you are in a hurry, and grab a bag for later. Consistently excellent coffee, zero fuss and a calm pocket right in the CBD. | By far the best coffee (flat white especially) I found in Melbourne to my liking. Tried several famous cafes in Melbourne but nothing beats this place. Also the beautiful facade and interior design. Beware that there's no sitting inside. They also don't serve any pastries if you're looking for any bites.",cafe_brunch_bakery_desc
ChIJvY3SZ5tD1moRrw9888Iui6g,"A really nice little coffee spot with great drinks and baked goods, especially the matcha and cookies. The service is great with friendly staff and thus it’s a place I’ve come by multiple times. Thank you to the hardworking staff 😊 | Escape the hustle and bustle and sneak towards the strand and hide away with a cuppa from Parlance Cafe. Discreetly tucked away in the strand towards the exit of emporium is this pleasant cafe serving an option of sweets, cakes, croissants and more! The coffee is above average and served with a polite and friendly smile! Once you have received your delightful order snuggle onto the centre’s cushioned seats available in front of the cafe as seatings is not available in the cafe, it is dedicated and designed for take out only.",cafe_brunch_bakery_desc
ChIJ7VH3cIlD1moRqKJMYoMFPOo,"Absolutely delicious Colombian and Latin food! Every dish was bursting with authentic flavour and beautifully presented. The service was outstanding, warm, friendly, and attentive. You truly feel like you’re visiting family. The atmosphere is cozy and inviting, making it a perfect place to enjoy a taste of home away from home. Highly recommended for anyone looking to experience the best of Colombian cuisine in Melbourne! | Absolutely love Encanto! I’ve been twice now and it’s quickly become one of my favourite spots in Melbourne. The food is incredible — every dish I’ve tried has been bursting with flavour, and the portion sizes are huge (I’ve never been able to finish a main!). From the moment you walk in, you’re welcomed by the most amazing aroma from the kitchen, and the atmosphere feels warm and inviting. The staff are beautiful, super friendly, and always have spot-on recommendations. I’m officially on a mission to try the entire menu",cafe_brunch_bakery_desc
ChIJdzhLqbVC1moRmwelS6oiVkk,"Cosy Italian cafe serving baguettes, coffee and hot food, with gluten-free choices, and a kids menu.",cafe_brunch_bakery_desc
ChIJKX5tnkBD1moRwt30NN8sXWU,"The coffee was really delicious, but for some reason the staff seemed to be discriminatory. They kept smiling at the white customers, but were extremely impatient when I ordered. As a foreigner, I was a bit confused and asked very politely, but they had a really bad attitude and were super mean. | I decided to try this coffee because it looks nice from the outside. Unfortunately by the professional look, they gave me an unbranded cup 😂 even worse that a convenient store coffee, they still have their own branded cup. The flat white has too much milk taste, I couldnt taste the coffee. And had to finish as quick as I can, coz its not good.",cafe_brunch_bakery_desc
ChIJ39GiLxdd1moR3M_M-48jQoE,"I love Bingsu and decided to give this place a try after my friends kept raving about it. I tried their signature Thai Tea Bingsu, the Mango Sticky Rice Bingsu, and the Pandan & Coconut Shokupan. The Thai Tea Bingsu could’ve been a bit sweeter for my taste, but the Mango Sticky Rice one was really unique and flavorful. The Pandan & Coconut Shokupan was the highlight—so soft and delicious! The portion sizes are a bit smaller compared to other Bingsu places I’ve been to, so keep that in mind. Also, the space is quite small and seating is tight, so it might not be ideal for big groups. Still, if you’re a dessert lover, it’s definitely worth a visit! | If you’re looking for the perfect sweet treat after a meal, this is definitely the place to be! Their desserts are not only delicious but also perfect for sharing with a couple of friends. I came here with a few mates after dinner and we decided to try their famous bingsu. We went for the mango sticky rice flavor this time, and wow… it was honestly amazing! The mango was fresh, sweet, and juicy, the sticky rice had the perfect chewy texture, and the creamy shaved ice just tied everything together beautifully. Every bite felt refreshing yet satisfying, not overly sweet, just right. It’s the kind of dessert that makes you want to slow down and enjoy every spoonful. We couldn’t stop talking about how good it was, and by the time we finished, the bowl was completely clean. If you’re a fan of mango, you’ll love it, but even if you’re not, I think it’s still worth giving it a try because the balance of flavors is just spot on. Highly recommend bringing your friends here after lunch or dinner—you’ll leave with a happy stomach and a smile. Definitely worth coming back for more!",cafe_brunch_bakery_desc
ChIJ4ZXKn7RD1moROn5o7ZzHSK8,"Sat here because Lulu's was full. Ordered the hainanese chicken rice and Pandan croffle (croissant and waffle mix) and they were both tasty. Service was efficient and friendly. | Indonesian trying the food in here. So far so good. Its also good location to enjoy the feel and environment. Last time I ordered Nasi lemak. Nasi lemak is good but unfortunately when I ate, the rice is kind of hard to eat its like leftover rice and the cucumber is already old. The Anchovy's bone might be has kind of small and it was prick my gums when I ate. Sorry I had to put 3 stars only, but I believe Pandan has still a lot of rooms to grow. Anyway thank you 🙏",cafe_brunch_bakery_desc
ChIJQfl0JgBd1moRJv7zHmKAPyU,"Our fusion linguine and croissant meal were very delicious 👍 Matchamisu was nicely done too! Overall, it was a fantastic lunch experience. | We ordered: • Go-Miso Soft Shell Crab Linguine ($32) • Unagi Don ($28) The Go-Miso Soft Shell Crab Linguine was extremely salty and heavy. I understand miso itself is salty, but it felt one-dimensional—just saltiness without much balance or creativity. I had to keep drinking water, but it still left me feeling parched. The Unagi Don was also disappointing. The eel tasted like it had been frozen—the texture was soft and lacked freshness. The flavor relied heavily on the eel sauce, which was overly sweet and cloying. The rice, however, was pleasantly chewy. The biggest letdown was the Lemonricano ($7). I expected something refreshing—black Americano with lemon—but instead, it came with a huge amount of granulated sugar sitting at the bottom, completely unmixed. Each sip tasted more like sugar than coffee, which made it undrinkable for me. I only managed two or three sips before leaving it aside. We finished our meal in about 15 minutes. Service was polite and attentive, but the dining environment felt rather basic. Sadly, both my husband and I felt unusually thirsty for hours afterward, even after drinking lots of water. Overall, it didn’t live up to the expectations I had when I first saw the menu.",cafe_brunch_bakery_desc
ChIJe8M9elxD1moRschc9BopmmY,"A very nice and simple coffee house. A good place for an early break with interesting food options. Indeed, hot home made toasts are available and they are delicious 🥪 Besides the cookies are very fine, crunchy and smooth 🍪 Eventually the coffee and chocolate were good and quickly served by the smiling staff! | I was drawn in by a little green smiley face sign on Little Collins Street and I’m so glad I followed it 😍 This cozy little café serves a range of coffees and light meals, perfect for either takeaway or dine-in😉 We ordered their Magic which is a Melbourne coffee classic and it was absolutely spot on👌 Brewed perfectly with their house blend beans, it had a rich, smooth flavor that we all loved 🥰 If you’re on the hunt for that true Melbourne Magic coffee experience, I highly recommend giving this place a try, you won’t be disappointed 😉",cafe_brunch_bakery_desc
ChIJNar7yGxd1moRChp3KKWw3Tw,"Awesome small coffee shop! Get your morning coffee to go or have a seat in the small hole in the wall coffee shop. Great coffee with a good selection of pastries to get you going in the morning. Friendly and helpful staff that will also warm up your pastry upon request. | One of good coffee shops in Melbourne. Coffee is good!! *strong flat white is my go to coffee Also the pastries, especially my favorites is chocolate croissants 🤤 This place’s friendly with kids, they have baby chino plus marshmallows for my little daughter. Almost every weekend spent time here with my family. Really recommend this coffee shops. 👍🏼👍🏼👍🏼",cafe_brunch_bakery_desc
