place_id,description,category
ChIJ-f1KXUld1moRewzHfD9Op5Q,"I already knew this place was popular for Hock and Belly, but today I tried the Mara Spicy Hock Soup and completely fell for it. On top of that, the manager (or maybe the owner?) was incredibly kind, fun and friendly — he made the whole dining experience extra warm and welcoming. With such a pleasant experience, I’d definitely come back. | Good customer service. I love the vibe in the restaurant. Good food and reasonable prices and a variety of menus. Open until late and probably come back again! 🫶🫶☺️",restaurant_english_clean_desc
ChIJhz6IIUxd1moRR6Z2jb_YP7U,Afro-Portuguese chain for flame-grilled peri-peri chicken in African bird’s-eye chilli at different heat flavours.,restaurant_english_clean_desc
ChIJ2VbXq7VC1moRIusyretJXMg,"Local standby for Indian classics like chicken tikka in a simple spot, plus meal deals and delivery.",restaurant_english_clean_desc
ChIJd5kNx7RC1moR-pM_GKr9bKQ,"Stylish, airy cafe featuring dim sum & handcrafted Chinese teas, as well as cocktails.",restaurant_english_clean_desc
ChIJqRdazrRC1moR6lOn1uXXJO8,Modern Asian food in a sprawling space with bar & tables underneath a huge red lantern.,restaurant_english_clean_desc
ChIJjUllVLZC1moRM7QWhmwB4qE,"Spanish tapas plates, sangria and wines served in a bustling bar with a trendy urban vibe.",restaurant_english_clean_desc
ChIJWZKyp0xd1moRLlaoxrFXzNc,"Indian madras, masala and kormas, served in a homey dining room with simple decor and downlights.",restaurant_english_clean_desc
ChIJjxWPpUxd1moR4THuwdvqlPE,Pub in a 19th-century building with a huge beer garden & a historic bistro serving a wide variety of dishes.,restaurant_english_clean_desc
ChIJBaUBTrRC1moRNdF-YqUyESg,"Let’s begin with the basics, this place doesn’t seem to understand the difference between high tea and afternoon tea, which is unfortunately all too common in Australia. It would be worth brushing up on the definitions before making bold claims. If you’re someone who values the authenticity of British traditions, consider yourself warned. The venue itself is tiny, truly difficult to find, and sadly, any sense of elegance or refinement is lost the moment you step inside. A handful of tables were occupied, none of them particularly clean, and the overall atmosphere was one of a place in decline. It feels poorly maintained, with no effort made to live up to the sophistication typically associated with a proper afternoon tea experience. To their credit, there is a decent tea selection. Thank you for that. However, the dessert offering was minimal, and what was there looked rather tired and uninviting. The staff were friendly and polite, which was a small redeeming feature, but unfortunately not enough to salvage the experience. In short, if you’re up for a bit of a challenge or enjoy novelty over quality, give it a go. Otherwise, you might be better off elsewhere. | The best cup of tea I’ve ever had. Cannot find fault. This place was perfect. So cute, friendly staff, and seeing into the kitchen is a big interesting plus! Loved every bit of my experience here",restaurant_english_clean_desc
ChIJ_xrZZEtd1moRxb9el7EM1TA,"Upmarket property featuring lively dining & a fireside bar, plus an indoor pool, a spa & a gym.",restaurant_english_clean_desc
ChIJoboi5rRC1moRd4i9kw4uMY8,Diner serving regional Italian food & wine using ingredients from Emilia Romagna in Italy.,restaurant_english_clean_desc
ChIJRXUhQbVC1moRSlmDCW9TGNg,"Casual, compact Japanese ramen noodle bar with simple stool seating, exposed brick, and buzzy vibe.",restaurant_english_clean_desc
ChIJqTG_7bRC1moR7Dykdhg81HA,"Gourmet pizza parlour with calzones, focaccia, and dessert served in a casual, woodsy-chic space.",restaurant_english_clean_desc
ChIJl3Ooukxd1moRTV6KEHr9-Wc,"Mexican standards like enchiladas & tacos in a casual, enduring chain serving margaritas.",restaurant_english_clean_desc
ChIJ5Ss9WEtd1moR9-5n4onO_EM,"friendly staff, good portion, very tasty bbh :) | Staff was very friendly and helpful in making recommendations for vegetarian options. I had the vegan pho which was very tasty.",restaurant_english_clean_desc
ChIJk57je0td1moRkCY36RFTSMg,"Seasonal, traditional Sicilian food, served in a spacious, contemporary setting with big windows.",restaurant_english_clean_desc
ChIJaTce4Gdd1moREyRwOuVniOY,"Casual counter-serve chain for build-your-own sandwiches & salads, with health-conscious options.",restaurant_english_clean_desc
ChIJRZ0RDEtd1moRLratTptfP6U,Great food bur most of all friendly staff that actually apreciate your business. Nothing is to much trouble which i think is very reare these days. | Great for a quick lunch. Love their salad bowls which u can add on.,restaurant_english_clean_desc
ChIJBSIvyEpd1moRXo6K829C--Q,"For my first ever meal in Melbourne, this place is truly exceptional. My girlfriend and I ordered the Truffle Pasta and Limited Ham and Cheese Pizza. They were so good and priced just right. We couldn't finish so we had to takeaway leftovers, which just tells you the serving size. If you're craving pizza, there is no better place to be! Thank you as well to the kind and attentive staff. | A25 is definitely my favorite pizzeria in Melbourne. I used to go every Monday for MONDAY PIZZA, and it never disappointed me! The pizza is just like in Italy. light dough, well leavened, perfectly cooked, and really flavorful toppings. You can taste the quality of the ingredients from the first bite, it truly feels like eating pizza in Italy. Plus, great service from the waiter, always kind and attentive. Cozy place and quick service. Highly recommended!",restaurant_english_clean_desc
ChIJ9_Y4ybRC1moRKikLb3IbPAw,"Hip Korean restaurant and bar over 4 levels with bluestone walls, dark tables and hanging ornaments.",restaurant_english_clean_desc
ChIJidRmV0td1moR9NIteGY9FmM,"Fish and chips, burgers and grills in a laid-back, rustic Irish pub showing live sports on TV.",restaurant_english_clean_desc
ChIJlVWPC7VC1moR_VHmt-hA5mA,"Upmarket pizzeria and trattoria with over 50 wines, in rustic-chic surrounds with garden lanterns.",restaurant_english_clean_desc
ChIJeaaLoLVC1moRl5Tx6DdDLUA,"Koko Black is always a delight. The chocolates are, as expected, absolutely delicious—rich, smooth and full of flavour. The coffee is equally good and pairs perfectly with the sweets. The staff are warm and welcoming, creating a friendly atmosphere that makes it an easy place to relax. Whether you are stopping in for a quick coffee, catching up with a friend, or simply indulging in a treat, it is a lovely spot to enjoy quality chocolate and a well-made drink. If you are sitting on the upper level, take care when you start to come down the stairs. The very first step feels slightly higher than the rest. I even asked my friend and she agreed it is a bit tricky. | I recently visited Koko Black in Melbourne, and it was the perfect treat for any chocolate lover. The Signature Chocolate is by far the best I’ve had—smooth, rich, and absolutely decadent. It’s the kind of chocolate that melts in your mouth, leaving you craving more. The atmosphere of the cafe is elegant and cozy, making it a great spot to unwind.",restaurant_english_clean_desc
ChIJ6VLiOLVC1moRUX_Qgb0CEyU,Specialty coffee shop serving pastries in a compact space with chairs hanging from the ceiling.,restaurant_english_clean_desc
ChIJa68S77VC1moRTdJLPEIk4Ok,"Established, casual buffet restaurant serving European, Indian and Asian meat-free and vegan food.",restaurant_english_clean_desc
ChIJczdsN7VC1moR-QK-RzI-pJw,"Trendy, bare-bones Italian eatery dishing up thin-crust pizza, pasta, handmade focaccia and wine.",restaurant_english_clean_desc
ChIJCYzQJbRC1moRnD9tQLJY4PU,"Busy, cosy French creperie with a warm vibe, offering sweet and savoury options, cider and wine.",restaurant_english_clean_desc
ChIJX7KQMrRC1moRkE454aAntkc,"Modest cafe with split-level seating, serving traditional Italian pasta, risotto and desserts.",restaurant_english_clean_desc
ChIJy1omP7RC1moRqjAV2Wq6ICQ,"I have been looking for a place to try pumpkin soup during my visit. I had a pumpkin soup and a flat white coffee in the early afternoon. It's a smaller place in a little alleyway; it's very quaint, though. Just know there are not a lot of tables and so you may want to get your food as take-away if it's during q busy time. My server was friendly, and I enjoyed my soup and coffee. | Love the old school cheeseburger, chefs are bloody rockstars especially the guy who runs the food quite regularly, just incredible service! ( I’ll have to ask his name)",restaurant_english_clean_desc
ChIJ9782NbRC1moR5udzQ0gRERA,"I ordered something called simply...pasta. i was a bit leary. It came out in a bowl and looked like mystery mash. What it turned out to be, creamy pesto ravioli with chicken. It was delicious! Next time i will take photos as this truly a case of don't judgea book by its cover.",restaurant_english_clean_desc
ChIJFV7eOLRC1moR4e09ctwoRuU,"No wonder why, every time I walk past, every place is busy, only this place is quiet. Order a piece of salmon with a large salad. Compared with the demonstrated box for large and only half of the amount. That is a large salad for $14.9 (not included the charge for the salmon) with a few pieces of broccoli and a couple of carrots?????? The worst thing is the attitude of the staff. There is definitely no way I'll ever come back to this place. | Best big breakfast ever! Nice coffee and egg Benedict yummy TQVM!",restaurant_english_clean_desc
ChIJLx2B5bRC1moRgbrI1pZfZ2A,"I never thought I would find such an unbelievable banh mi in Australia. I had the crispy pork banh mi and lemon iced tea. The pork was crispy, the sauce was juicy, the bread was big and crispy, the whole sandwich was big and full, and you could feel the freshness of the bread. If you love Vietnamese food, this is a must-try place! I will be back. Highly recommended 😊 | We visited back in August but I am only just posting my review now. The food was excellent and really hit the spot. We had been craving Vietnamese and this was the perfect choice nearby. I had the chicken Banh Mi which was delicious, and the little alleyway seating added a lovely atmosphere too.",restaurant_english_clean_desc
ChIJ2f-iFLRC1moRL9heOZ7yBS4,"Cosy destination serving health-conscious, gluten-free cuisine & drinks, plus vegan options.",restaurant_english_clean_desc
ChIJ0w8qPLRC1moRgCk34Q_V9Uo,"Omg still dreaming of these dumplings weeks after visiting Shanding mamma. It’s actually very popular with people who know how to find them! It’s a bit hidden away and I only ended up here because my daughter recommended it. I now visited 3 times as I crave these dumplings. 🥟 juicy, fresh, real authentic taste. The place looks old but has that special market charm. Reminds me of times I spent in China little markets. We ordered 2 sets of dumplings. Both boiled and pan fried , and a potato salad. Highly recommend mackerel dumplings- very tender, melting in your mouth. | Family-style dishes from a small eatery in a bustling city. The fluffy bao buns were soft and filled with rich, tender beef shin. The pan-fried zucchini dumplings were sweet and tender, yet had a delightful Moorish chew. We also ordered the cauliflower skewers, garlic broccoli, and a bowl of steamed rice. Everything was delicious! You’ll be foolish not to try this place. If you like and appreciate this review please give it a like or a thumbs up so that I know what content to include in future reviews.",restaurant_english_clean_desc
ChIJg1wLO7VC1moRrzObM92WgkU,"Choice coffee, brekkie & bagels in a bright, airy space with eclectic decor & a vintage-chic vibe.",restaurant_english_clean_desc
ChIJtR0FTLRC1moRrDAzAV5Qk8A,"I was full after dinner, so I couldn't eat anything else. So I ordered a salad with the intention of eating lightly, and it was so delicious that I was amazed. This shrimp salad tastes very much the same as pattaya salad, and instead of papaya, we have carrots, cucumber coriander, and onions. I love Thai-style salad, so this one was also so delicious. For those of you who are worried about gaining weight in the evening, I think you will be healthy eating this salad. It is so delicious because it is made with a fish sauce that is lighter than a heavy sauce. And there was a traveler from Korea from the next table, and I was very moved to see that the staff in the picture kindly guided me. I'm sure he will be very kind to other customers. | We stayed a night in Novotel and for convenience decided to eat in the onsite restaurant. While there are a huge amount of places to eat in the area, after a long day you could certainly do far worse. Service was decent, helpful, polite, and prompt. The food was actually better than expected. With the child being a highlight. The t bone was fine, though could have done with more of a sear. It was cooked perfectly medium as requested. The barramundi was great, though overpowered by the sour sauce. The kids meal (fish and chips) was exceptionally good value, as were most dishes. With the exception being the halloumi salad.",restaurant_english_clean_desc
ChIJd9XCrLVC1moRfoLEXRelVY0,"Friendly staff, and spacious. Heaps of seats around so perfect for friend catch ups or groups. Ordered a calamari salad and my friend had a Spanish breakfast. My salad was fresh and great with a lemon. Would have liked more of a crunch or sear to my calamari but still tasted great. My friend enjoyed his Spanish breakfast too. Easy to chat in the restaurant - not too loud. Overall a good experience. Coffee was also really good. | We came after breakfast service hours, so only the à la carte menu was available. We ordered the steak sandwich and the chicken sandwich, and both came with chips — everything was delicious! The atmosphere was really nice and cozy. I’d love to come back again early in the morning next time!",restaurant_english_clean_desc
ChIJg9OHO7RC1moR8LaOJz3PZok,"Italian cafe known for sweets, serving pizza & housemade pasta in a modern space.",restaurant_english_clean_desc
ChIJVUJ9_LVC1moRSoZpoRqqq8Q,"Casual Parisian-inspired bar with lounge and balcony areas, serving tapas, cocktails and flatbreads.",restaurant_english_clean_desc
ChIJcyt-r7VC1moR918ZijDitxU,"A hidden gem! A wonderful vegan jaffle café tucked away from the hustle and bustle. The food is so fresh, hot and delicious – perfect comfort food on a weekend. The menu is big with lots of options, and I can’t wait to come back to try more!” | I was planning to go to the bookstore but ended up stopping by this café. I didn’t realize it was a vegan café and even asked for full cream and honey, so sorry about that. I ordered an almond milk mocha with maple syrup. I had no idea they offered maple syrup, and it’s actually my favorite pairing with mocha when I make coffee myself. The coffee was amazing, with beautiful latte art made with almond milk and a lovely frothy texture. I also noticed the person next to me ordered jaffles that looked really good. I’ll definitely come back to try them next time.",restaurant_english_clean_desc
ChIJ4zzLEbZC1moRzkG67FkQbt8,"Established in 1975, this long-running teppanyaki restaurant and lounge serves classic grill dishes.",restaurant_english_clean_desc
ChIJxaPHvrdC1moRseaEXnZ54ns,"Indian meals in an eclectically decorated restaurant, with Bollywood movies and dancing.",restaurant_english_clean_desc
ChIJjUllVLZC1moRFJto433jNAY,"Spanish tapas plates, sangria and wines served in a bustling bar with a trendy urban vibe.",restaurant_english_clean_desc
ChIJ9duozrdC1moRtuPvobzf_Zs,"Trendy, industrial-chic basement space serving upscale Vietnamese fusion plates and set menus.",restaurant_english_clean_desc
ChIJAQB0FrZC1moRPAhqqX88Tik,Contemporary dishes with an Asian-inspired twist in an upmarket restaurant & bar.,restaurant_english_clean_desc
ChIJwfeAL8hC1moRk9bdTfZtuQ0,"Italian food in a warm, rustic basement space with wine-stacked shelves, or in casual upstairs cafe.",restaurant_english_clean_desc
ChIJjUllVLZC1moR3g3kXGJue4Q,"Spanish tapas plates, sangria and wines served in a bustling bar with a trendy urban vibe.",restaurant_english_clean_desc
ChIJ9YePsLdC1moRhmhASJxsSqk,"Modern, 2-storey pub with polished timber floors, a stylish lounge bar and relaxed terrace seating.",restaurant_english_clean_desc
ChIJYSmyK8hC1moRmVPgsY1Nk-k,"Grand Hyatt Melbourne’s signature restaurant, offering cuisine cooked over smoke & flames.",restaurant_english_clean_desc
ChIJy453xbdC1moRRFDpPBRtbXs,"Jumping industrial-chic bar serving meat, fish or vegetarian balls, light bites and Italian wines.",restaurant_english_clean_desc
ChIJp5vh7MlC1moRDB-VRV-nzI8,Flashy cocktail bar serving a gastropub menu amid a psychedelic colour scheme & quirky animal decor.,restaurant_english_clean_desc
ChIJfW9q5rdC1moRuFUkIp6ngjg,"Busy, contemporary-design restaurant with art installation ceiling, serving upmarket Indian cuisine.",restaurant_english_clean_desc
ChIJrbHS48dC1moR9M42ZaCEip4,"Ornate tiles line the walls of this slick, modern Italian restaurant and bar with an intimate vibe.",restaurant_english_clean_desc
ChIJEdmGbLZC1moRxJDyMxMDONc,Creative takes on locally sourced seafood served in a classy setting with outside seating.,restaurant_english_clean_desc
ChIJ5SNEm7ZC1moRM0anzxjVyJw,"Staff were nice and gave us free food, but poor ingredients on pizza, cheese was stale, very flavourless and lacked crispiness and not great for the price. | Food portions are small not Enough for the size and it's very cold. And also the place is very smelly, tables aren't wiped. Very dirty place. I even lost my appetite. Please at least clean the place.",restaurant_english_clean_desc
ChIJ-3pBRbZC1moRYYE99vZuNy8,"Sleek restaurant featuring sophisticated Japanese cuisine, a chic wine bar & private dining rooms.",restaurant_english_clean_desc
ChIJNVF8Q7ZC1moRarO5qwt4NOA,Communal benches & an open kitchen create a buzzy setting for Asian-inspired cuisine.,restaurant_english_clean_desc
ChIJX-_eyLdC1moR2lo_rt_gBX0,Choice Asian share plates and cocktails in a trendy hangout with an open kitchen and striking decor.,restaurant_english_clean_desc
ChIJ__3SxLdC1moRvQXAfpwM1hI,Relaxed restaurant with an Asian-inspired menu & local art exhibits above a cocktail bar with DJs.,restaurant_english_clean_desc
ChIJ7aS6NMZC1moRPat4zsZcxA4,"Spacious, high-ceilinged spot with hanging lights and a muralled wall for Mexican food and tequila.",restaurant_english_clean_desc
ChIJ0xwW4cdC1moRe81ERqyUZpk,"Spacious monochrome Modern Italian restaurant with slick decor, hanging dome lights, and cellar bar.",restaurant_english_clean_desc
ChIJAwLSzMdC1moRC4BHUsdWkpQ,Elegant hotel restaurant with upscale dishes and stunning city views through ceiling-high windows.,restaurant_english_clean_desc
ChIJAVfi1sdC1moRV7tww9krhXg,Bright and spacious Japanese restaurant with an open kitchen and a sprawling maze of eating areas.,restaurant_english_clean_desc
ChIJc-7BSMhC1moRIjETg7EmJyw,"Upscale, light-filled hotel dining room offering local Australian fare & a breakfast buffet.",restaurant_english_clean_desc
ChIJN0AnAchC1moRUeQkcSOBLuI,"Industrial restaurant offering burgers, sandwiches & all-day brunch, plus Friday night DJ sets.",restaurant_english_clean_desc
ChIJq_Q3_bdC1moRTK6LBjNhFL4,"Classy bar with whiskey, cocktails and tasting menus, plus a hidden lounge behind a bookcase.",restaurant_english_clean_desc
ChIJA8SzVedC1moRLzSL5TQsovg,"Clever Asian fusion meals and banquets in a modern, buzzy space with an airy feel.",restaurant_english_clean_desc
ChIJBw5qAshC1moRnE3tP2RBM_I,"Cool chain for burgers and sliders made from carefully sourced produce, plus low-carb options.",restaurant_english_clean_desc
ChIJ4alrwcdC1moRUWjI-7mjBks,"Trendy operation doing out updated street food classics, as well as cocktails jugs.",restaurant_english_clean_desc
ChIJQwd52MdC1moRbqktY2gqhRk,Nice sushi roll !fresh and delicious ~🍣and also have bento | Lots of sushi variety to satisfy your healthy rice appetite. Very convenient fast food.,restaurant_english_clean_desc
ChIJsSdU2MdC1moRZcjvV3GqbRc,"Casual spot serving classic Vietnamese street food, including banh mi, pho & dumplings.",restaurant_english_clean_desc
ChIJR98TL8hC1moRSLN8MxbWsEE,"Upscale spot presenting French cuisine, a raw bar & drinks in a white-tablecloth dining room.",restaurant_english_clean_desc
ChIJQwd52MdC1moRp_Up79F6RP8,"😁🔥 An Outstanding Lunch Experience at Earl Canteen (45 Collins St.) If you’re in Melbourne’s CBD and looking for a spot that perfectly balances fresh, high-quality ingredients with a relaxed, welcoming atmosphere, look no further than Earl Canteen. I recently had the pleasure of visiting their Collins Street location, and I can confidently say that it exceeded my expectations in every possible way 🌟. 🥪🥖 Let me start with the food, which is the highlight of this gem. I decided to try their Chicken & Hummus Sandwich ($16.50), and it was, without exaggeration, one of the best sandwiches I’ve had in a long time. The chicken was perfectly cooked—juicy and tender—while the hummus provided the right amount of creaminess that balanced the flavors beautifully. What really stood out was the attention to the finer details. You can tell that the ingredients are sourced thoughtfully; every element in the sandwich felt fresh and packed with flavor. Whether it was the crispness of the vegetables or the softness of the bread, each bite felt carefully crafted. Earl Canteen doesn’t just serve “food”; they create a meal that feels nourishing and indulgent at the same time. You can truly taste the difference when the team behind the counter cares about the quality of what they serve. It’s clear that they’ve put a lot of thought into their menu, offering options that cater to a variety of preferences and dietary needs, without sacrificing flavor or creativity 🌿. If the chicken and hummus sandwich is any indication of their other offerings, I can’t wait to come back and explore more of their menu! 🤩🎉 The ambiance of the space also deserves a special mention 🏙️. In the heart of Collins St., Earl Canteen provides a calm and cozy escape from the busy hustle and bustle of the city. The interior is modern yet comfortable, with a minimalist design that doesn’t feel overly crowded, even during the busy lunch hours. I was there around peak time, and while the place was lively, it maintained a sense of order and calm. Whether you’re grabbing something quickly for takeaway or dining in, the layout makes it easy to enjoy your meal without feeling rushed or cramped. What’s even more impressive is the level of service. The staff at Earl Canteen were incredible from start to finish 🙌. They greeted me with a warm smile as soon as I walked in, and despite the midday rush, they were efficient and organized. It’s not easy to maintain such a level of customer service when the place is packed, but they did it with ease. I also appreciated how they took the time to explain a couple of items on the menu when I asked for recommendations. You can tell that the staff are well-trained and genuinely care about giving customers a great experience. Another aspect that sets Earl Canteen apart is how accessible and convenient the location is. Being situated on 45 Collins St. makes it ideal for anyone working in the area or just passing through. It’s the perfect spot for a quick lunch during the workday, but also versatile enough for a more leisurely meal if you have the time 🗺️. Whether you’re a local or a visitor to the city, the ease of access and high standard of food make it a must-visit. One thing I truly appreciated was how they’ve managed to create such an inviting space without losing efficiency. The staff handled the lunch rush smoothly, and I never felt like I was waiting too long for my order. It’s one of those places where you can count on the service being just as good as the food, and that’s a rare combination. Overall, Earl Canteen has quickly become one of my favorite lunch spots in the city. From the food to the service to the atmosphere, every detail has been carefully thought out, ensuring an exceptional dining experience. If you’re a fan of fresh, wholesome meals that don’t compromise on flavor, Earl Canteen is definitely worth a visit. I’ll definitely be back soon to try out more of their menu options and to relive this wonderful experience! 👏🍴 | Food is great, delicious. Recommend However this company really needs to be more conscious of wasteful packaging when catering for office sites. Please use less plastic and bags for corporate catering. I have had a lot of catering deliveries and this company uses more than others. More Environmental impact for sake of convenience.",restaurant_english_clean_desc
ChIJQwd52MdC1moRc1D3BTBHTLs,"Choice is OK and the food was reasonably tasty - just not very hot. Vegetable Spring roll was looking a bit sorry. Tasted the same. Miso Chicken and Beef were OK just not very hot. Average experience. | Good sized portion for about $18. Wait time to table about ten mins although my associates took a little longer. Nice katsu chicken curry, nothing flash or extreme but the size pops it up to a 4****. Would visit and have again.",restaurant_english_clean_desc
ChIJQwd52MdC1moRuQepzl6YG7U,"Lively counter-serve chain serving traditional tacos & burritos, plus Mexican beer.",restaurant_english_clean_desc
ChIJZZAk3rdC1moRBLbi71KAUfc,"Brekkie, coffee & salads, offered in a sleek space with polished concrete floors & long tables.",restaurant_english_clean_desc
