place_id,description,category
ChIJKx7Qjmhd1moR0YknHQs-WBc,"Hearty meal, a lovely introduction for myself to Ethiopian dish. I am also so impressed by their coffee - the real deal of Ethiopian coffee. | I love Ethiopian foods most especially the injera. I was looking forward to have a nice meal. But, this is the worst Ethiopian food I have ever eaten! Everything was cold and tasteless. Very disappointed!",restaurant_english_clean_desc
ChIJXyukQDRd1moRC6tqWbLsBWU,"The food here is awful, I've tried a couple of times hoping that it's just been a bad day, but I've now come to the conclusion that it's just terrible and they make their money off unsuspecting tourists. Avoid especially as there are plenty of other options in the area!! | The worst food avoid at all cost",restaurant_english_clean_desc
ChIJ9_R2u9Bd1moRDOQtn0C9pQw,"Unlike the other reviewer, I had an amazing experience here at Market Kebab. Staff was friendly as well. I had ordered a chicken bowl with fries combo, but I’ve mistaken that it comes with drinks, the staff was friendly enough to double check my receipt and helped me with a can of drink and I only had to top up the difference instead of the full price for the drink. Food was amazing as well, tbh I’ve not eaten a lot of kebab to be able to professionally tell you if it’s the best or worst, but I can confidently tell you I enjoyed every bite of it with no complaints. | You couldn't get me to eat here again if you paid me. I've seen tastier looking food in a dogs bowl. Pre cooked reheated kebabs , customer service is non existent. And the food is garbage",restaurant_english_clean_desc
ChIJTQxR9jJd1moRhc72ZLF-Lvk,"⭐️⭐️⭐️⭐️⭐️ I recently visited Arabesque Restaurant & Lounge and only tried the food, and I must say—it was outstanding. The flavors were incredibly authentic, with every dish tasting homemade and true to Middle Eastern tradition. The seasoning, freshness, and presentation showed real attention to detail. The menu offered a wide variety, and everything we ordered was both delicious and satisfying. It’s rare to find a place where the food alone can create such a memorable experience, but Arabesque delivers exactly that. If you’re looking for genuine, flavorful, and authentic cuisine, this is the spot. Highly recommended for anyone who appreciates quality food. | If you’re after big portions and rich, hearty meals, this place delivers. The food is delicious and leans toward the heavier, fattier side of Arabian-style cuisine. However, if you’re looking for more than just a good feed — such as a pleasant dining atmosphere — this might not be the spot. The dining area is quite dark and gloomy, with no real sense of an Arabian ambience or décor to match the food style. Also worth noting: no alcoholic drinks are served or allowed here.",restaurant_english_clean_desc
ChIJHcjvXzJd1moR4jUhMa4Ted0,"The pizzas were so bad dude, I wanted to try a new pizza place in the city and came across this one. I ordered the Peri Peri Chicken and the meat wasn’t even cooked. To confirm, i asked a few friends for a review and they couldnt even finish their slice. The meat was raw and tasty ridiculous | We enjoyed our visit to Duke Pizza this week. The Pizzas are very filling and the desserts are so delicious. Although, there could have been more topping on the pizzas as they were very thin. They have some great deals that occur during the week like $5 for a 24 include a slice of pizza which is cheap and enough to feed one.",restaurant_english_clean_desc
ChIJCeE4_jJd1moRrIgIE_RiuZg,"Traditional, warm and rustic Irish pub serving hearty meals with homemade butter, bread and bacon.",restaurant_english_clean_desc
ChIJTXrNbQBd1moR8RKcEbCYjgo,"The food was great 👍 we ordered fresh seafood moreton bay bugs with Oysters and prawns 🦐 and was really fresh. Then we ordered fried seafood platter which was lovely cooked to perfection so fresh not to much batter chips where the best. Seafood is really cheap the platter is huge and only $30 😃 would highly recommend this place to anyone. I will be definitely going back again soon. | We stopped by Saltwater Sushi and Oyster Bar at Queen Vic Market and were impressed by the friendly staff and the appealing selection of sushi, sashimi, and seafood. The display was vibrant, and everything looked fresh and inviting. We decided to try the lobster roll, one of their signature items. While the presentation was great, the roll itself was cold in the center, suggesting it had been frozen and wasn’t thoroughly warmed through. That really took away from the experience, as we were expecting something freshly prepared. It was also overloaded with onion - honestly, I’ve never had onion in a lobster roll before, and it was overpowering and kind of gross. That said, we still appreciated the wide variety of seafood on offer and the courteous service. They also had a wide selection of drinks. With a bit more attention to preparation and more balanced ingredients - especially for the lobster roll - this place could easily become a go-to for seafood lovers, unfortunately right now it feels like a waste of money.",restaurant_english_clean_desc
ChIJD-wAZTNd1moRWOPU5Ada0kw,The fish laksa was good. There are a lot of condiments to customise your food to your liking. The food came out fast. Price is alright for the portion. I wish they would let you choose the type of noodles you want. I'd like the egg noodle than the rice one. | They are super busy on Saturdays. This was hands down the best beef rendang I have tried in Melbourne - got it with the nasi lemak which was soooo fragrant & coconutty 😍 The serving size was also massive. I’ve also tried their laksa - not my fave but still very good. Their hainanese chicken rice is excellent. You really have to be assertive to get served.,restaurant_english_clean_desc
ChIJmdDrfTNd1moR3lL-_mUgSgI,"Went for dinner on Saturday night. This place exceeded our expectations. We were expecting great food and they definitely delivered. We decided to have the Paella de Mariscos, and given it takes ~30mins, had a few Tapas to start with. We ordered the Oysters with a saffron granita, croquetas de jamon, and the special, salted cod croquetas. All three tapas were awesome. We also received an additional (free) tapas - stuffed piquillo peppers. The paella was well worth the wait, perfectly cooked with a great mix of seafood. We finished the meal off with a shared slice of Basque Cheesecake. The wine list is comprehensive, with a great mix of local and international wines. We had a lovely Spanish Tempranillo. The staff were friendly and very attentive. The owner also made a point of chatting with everyone, we chatted to her quite a bit throughout the night. She was lovely. Would definitely recommend this place and will go again when next in Melbourne. | As a professional chef, I approach every dining experience with a critical eye—evaluating technique, flavor, presentation, and attention to detail. This Spanish restaurant delivers a well-balanced offering that combines authentic traditional cuisine with modern touches, executed with care and precision. We started with the croquettes, which were outstanding: perfectly crisp on the outside, with a creamy, well-emulsified filling and a refined, lasting flavor. A clear example of quality ingredients and classic technique done right. The omelet was another highlight. A simple dish, but one that requires skill. It was cooked to perfection—soft and juicy in the center, with a generous amount of melted cheese that added richness without overpowering. A dish that shows respect for both the product and the guest. The cheesecake is a must for those with a sweet tooth—rich, smooth, and indulgently sweet, with a well-balanced base that brings the dessert together beautifully. We finished with a deep, flavorful coffee and a fresh orange juice that tasted just like homemade—natural and refreshing. Beyond the food, the service was truly exceptional: warm, knowledgeable, and genuinely attentive. The restaurant also offers a wide range of price points, making it accessible for different budgets without compromising quality. In summary: A place where Spanish culinary tradition is respected, professional techniques are well applied, and the overall experience is both satisfying and memorable. Highly recommended for anyone seeking honest, flavorful cuisine—especially fellow hospitality professionals.",restaurant_english_clean_desc
ChIJGZyNi71d1moRoYjfGNbErMc,"Feel like coconut water was added to the coconut latte, so it’s fresh & not super sweet.",restaurant_english_clean_desc
ChIJu8BTxSVo1moREmTgfdGpHsY,"Best mussels i've ever had, so tender fresh and flavourful! Have to order the chilli coconut cream mussels, not too spicy for non spice eaters and the sauce really elevated the mussels. I would not recommend the white wine cream mussels as the taste of the white wine is way too strong and it threw us off (though the chef was kind enough to recook it with more cream for us, appreciate it) Definitely will come back again for other flavours! | After visiting three times over the past few years to indulge in my favorite mussels, I’m happy to say the quality has remained consistently excellent. I first discovered this gem back in November 2021, right after the pandemic, tucked into a cozy corner of Queen Victoria Market. It’s a charming setup — almost like a street-style pull cart where the mussels are cooked fresh. Though there’s usually a short queue, the wait is only about 5–10 minutes. Seating is self-service, so it’s best to come with a friend — one can grab a table while the other queues for food. The menu offers several sauce options, and after trying most of them, I’d say the white wine version is my top pick — it brings out the natural flavor of the mussels beautifully. It is plump and juicy. The cheese option comes next, though it can be a bit rich. The spicy coconut cream base is perfect if you’re in the mood for something with an Asian twist. I found the red wine and chili base to be just average, while the steamed mussels were decent as well. The familiar auntie who was there only last 2 visits were not there today. Each pot is priced between $14–$19 and comes with one or two slices of bread. It’s a simple yet satisfying experience, especially if you grab a drink from one of the nearby stalls to enjoy alongside your mussels. Always a pleasure coming back here!",restaurant_english_clean_desc
ChIJc3_aT6dd1moRcN1d0K045Yw,"Lovely sandwich place to get Burgers, Chicken skewers, Burek’s, drinks. Service is prompt and prices reasonable. Tried their chicken skewer wrap, fresh lettuce and tomato. | Something about their hotdogs that keep us coming back when ever we are in Queen Victoria Market. Simple things in life are often the best. This place make coming to the market so much more fulfilling and enjoyable. Must try if you havent done so.",restaurant_english_clean_desc
ChIJywEynDRd1moRKoaK_Ph9wnA,"The cafe wasn’t very crowded early in the morning so the service was very quick, the atmosphere was lovely, the staff very attentive and eager to help. I ordered an Eggs Benedict with salmon and mushrooms which was fantastic, as well as a passion fruit matcha latte, which was also lovely, though not as much as I’d like as it had a lot of ice but it still tasted great. The only other thing I’d say is the cutlery wasn’t really suited for cutting things well, but I’d definitely recommend and will be coming back. | Cafe Victoria offers a cozy and satisfying brunch experience. The bagel sandwich is fresh and well-balanced with greens and salmon, while the open-faced toast topped with pickled onions and rocket is both vibrant and flavorful. Their coffee—served with nice latte art and a touch of chocolate dust—is smooth and aromatic, making it a perfect pairing. The pastry selection is also tempting, with a wide variety of beautifully presented options like matcha scrolls and cruffins. Overall, a solid spot for a relaxed brunch with good taste and presentation.",restaurant_english_clean_desc
ChIJr0W0rxZo1moRhh7hJlQtSiE,Cafe dishing up international flavours with extensive range of bratwurst in a popular food market.,restaurant_english_clean_desc
ChIJhwU4_dFd1moRqkSHXQEH0DM,"Straightforward establishment offering traditional Indian street food, tandoori dishes & curries.",restaurant_english_clean_desc
ChIJUSPUegBd1moRQQrNjB1MDJY,Good place for dinner and chat | Melbourne's niche husband-and-wife team's private kitchen will come again,restaurant_english_clean_desc
ChIJ2wULTxRd1moRR08qn-sXwKE,"One of the best spots in Melbourne for authentic Indonesian comfort food! 🇮🇩✨ The Nasi Bali here is absolutely the best in town – generous portions, rich flavours, and the perfect mix of sambal, meats and sides that instantly takes you back to Bali. Highly recommend also trying their Bebek Goreng (crispy fried duck), Iga Bakar (grilled ribs), and the classic Mie Goreng – all cooked to perfection and packed with traditional flavours. Don’t miss the Roti Bakar Kenangan – a simple yet nostalgic treat that pairs so well with their drinks. Great service, cosy atmosphere, and truly authentic taste. Definitely a must-visit for anyone craving real Indonesian comfort food in Melbourne! 🙌 | Very delicious Indonesian food, we love the chilli in it 👍 Staffs were nice and friendly! Overall it was a lovely lunch experience celebrating Father’s Day in a nice family style setting.",restaurant_english_clean_desc
ChIJ7wzUC0Fd1moRKHQMuSV3kVI,"Update your damn business hours! It's never accurate! Anyway their Lanzhou Beef Noodle Soup is similar to Master Lanzhou, no numbing effect if you know you know. Good price but you won't get as much meat compared to the other Lanzhou Noodle shops nearby. Also you cannot choose Noodle sizes. | I ordered the braised beef brisket noodle and it was so good. It was a mildly cold night in Melbourne and it was so satisfying to eat a bowl of noodles at this small joint, away from the busy area of the CBD. There were probably about 10-15 tables in the restaurant so there are plenty of spaces to sit when we got there. The cold dishes were pretty good as well. A combo set was what I ordered and I was more than full after everything was finished. Service wasnt bad either. From where we sat, we could see the kitchen. The noodle master in the kitchen was creating the noodles from the dough and cooked fresh. The flavours and the texture was just delicious.",restaurant_english_clean_desc
ChIJZZzb6nNd1moRit6qgym4yPA,"Made a reservation for dinner on a weekday and had the tori tendon with some extra tempuras. Ordered via the QR code on the table and the food took around 15 minutes to arrive. The portion was decent for the price. Most of the tempura pieces were light and crispy, the soft boil egg was perfectly cooked with a creamy yolk, and the sweet tendon sauce goes well together with the tempura and rice. The only thing I didn't enjoy as much was the vegetable kakiage which either has a different batter or was overcooked; too crunchy and heavy. | I was happy to find that there was a Japanese restaurant that specialised in tempura so I had to give it a try. We came around 6pm on Wednesday and we had to wait for about 5 minutes. The tempura was good but the sauce was a bit too little even though they allowed you to ask for more if needed. The extra which I requested arrived even in a smaller plate. If they could give an option in the online ordering to request how much sauce we wanted, that would have been better. The tempura was crispy on the outside and still soft inside. The matcha drink was ok. Overall, I had a good experience at this place.",restaurant_english_clean_desc
ChIJj_q4u89d1moRHP97EfP5VLU,"4.5! During weekends it’s busy, but we managed to sit outside after waiting for ~5min. Had Onigiri set which was a perfect brunch. Onigiri was simple but really good, and the salmon was cooked perfectly. I recommend if you are craving light, healthy dish! We also had kinako matcha and lavender matcha - both very delicious and would def get them again. | Went for a quick bite for breakfast at Operator San, and left very satisfied. The atmosphere is cosy and inviting—perfect for coffee dates and catching up with friends, but could have the potential to feel slightly crowded and claustrophobic when going at peak hours. It also seems to be very welcoming to families and children. Observing the service, we found that most of the staff members seemed extremely friendly, except for the girl who was serving us, but it was honestly nothing major—we appreciate her for serving us!! We went at around 9:00am and did not have to wait long for food and drink. Onigiri Set — 8/10 The shiitake flavoured onigiri was the star for me. It was so packed full of the shiitake flavour—sooo delicious. Salmon cooked to perfection, juicy and flaky. Overall, a very balanced dish—sweet tamago contrasts both the savoury onigiri and miso soup while the pickles undercut the fattiness of the salmon. It is on the pricier side but definitely worth trying. Lavender Matcha — 9/10 The taste of the lavender worked so incredibly beautifully with the matcha. Sweetness was just right, very smooth, creamy and addictive. Only downside is that you get less than what you usually would with a standard matcha latte at $10. Highly recommend! Matcha Kinako — 7.5/10 Again, sweetness was just right and the kinako worked well with the matcha. No strong notes of coconut from the coconut foam which I did not mind, as the kinako flavour here is the true star of the show. Slightly less smooth due to the kinako itself but would highly suggest for those who are DF to try!",restaurant_english_clean_desc
ChIJLxkbkQVd1moRAAP7yQ3sdaQ,"Ordered the Deli and the Morta sandwiches takeaway. Service was super friendly and there wasn't too much of a line before the lunch rush. Both sandwiches were delicious, generously topped with meats, balanced with sauces and pickles. Bread is so light and delicious. Morta was our favourite but I'm still thinking about the sandwiches having finished them earlier today. Will be back to try the weekend porchetta sandwich and pizza | I tried the turkey, brie and cranberry focaccia sandwich and it was amazing. There was a generous amount of turkey, the bread was crispy yet fluffy and not too heavy. The cranberry paired perfectly with the cheese too. Only thing I wish was there was a bit more garlic aioli because it was a bit dry at times but other than that, absolutely perfect. Staff were super sweet too.",restaurant_english_clean_desc
ChIJm8e-QD1d1moRBU7gF3tr-LU,"Majesty coffee has a a nice atmosphere, probably best suited for smaller groups. The service was nice, very sweet and friendly. Strawberry cloud — 5.5/10 For a whopping $16 you get really cute presentation but a matcha that unfortunately does not meet the standards for both taste and amount. The matcha flavour was lacklustre, the overpowering strawberry flavour morphing the drink into something more like strawberry milk. Berry Nice Latte (w/ soy milk)— 4/10 At $14 this coffee is much more expensive compared to a standard coffee. Again, unfortunately the taste did not live up to a $14 coffee standard. The crushed dehydrated berries on top were a nice addition, but the coffee itself was way waaaay too sweet. The more I drank the sweeter it got. The coffee is missing the berry element, the caramel syrup is much more prominent. I would highly recommend that Majesty coffee try to make the strawberry cloud and berry nice latte much less sweet! Other than that, the presentation was indeed very lovely 😊 | As a professional chef, I'm always on the lookout for places that put care and technique into what they do, and St. Ali was a pleasant surprise. You won’t find an overwhelming menu or pretentious presentations here — but everything you order is well-executed, with quality and great flavor. The atmosphere is super relaxed and cozy, perfect for enjoying a coffee, chatting with someone, or just taking a break from your day. It feels warm, welcoming, and unhurried — like a little pocket of calm. The service was excellent — fast, friendly, and professional. It's always a pleasure to be welcomed with a smile and served efficiently. The savory food was the highlight. I had a ham and cheese croissant that was absolutely amazing — flaky, buttery, and perfectly baked. We also tried a Cuban-style bagel, which was full of flavor and had great texture. The menu is short but carefully curated: croissants, bagels, baguettes... simple things, but done really well. The coffee was great, and while the chai latte didn’t really stand out, it wasn’t bad either. The strength of the place is definitely in its savory offerings and the way they pair bread and fillings to create something simple but memorable. In short, St. Ali isn’t trying to do everything — just doing a few things really well, and you can tell. If you love enjoying a great croissant with a quality coffee in a relaxed and welcoming setting, this is definitely a place worth visiting. ✨ Highly recommended if you appreciate quality, friendly service, and well-executed flavors.",restaurant_english_clean_desc
ChIJBRam1otd1moR31D_k7TLn8k,"Can’t sing Brick Lane’s praises loud enough. Everyone was so friendly and helpful. Fantastic range of beers perfect for anyone’s tastes - there is truly something for everyone! The mulled ginger beer was DIVINE and perfect for a cold Melbourne winter day. Can’t wait to come here again next time I’m in Melbourne! I didn’t get the food but the dishes that the table next to me were mouth watering and made me disappointed I couldn’t stay for longer to order my own - huge FOMO!!! Right next to the market so perfect to pop into after you shop. Big shout out to staff member Eric who was super friendly and helpful and made my day, he epitomised service with a smile and helped me out greatly by calling me a taxi and made sure it waited for me while I gather my things. Eric you went above and beyond and you are a credit to Brick Lane!!! I will most certainly be back again next time I am in town. | Terrific atmosphere, sit inside or outside, food is always excellent, Staff super friendly and hubby is very partial to the Brew 😊",restaurant_english_clean_desc
ChIJbUVXvN1d1moRTW9db_29bp0,"Tried the Citrus Cold Brew and the Iced Matcha Latte. Absolutely loved both! good ice amount and not too sweet but still full of flavour! Cafe is next to the well known Queen Victoria Market. With beautiful outdoor seating. | Amazing place for matcha. Probably one of highest I’d rate, if not the best. Finding a good quality matcha that is done well is hard to come by these days. Perfect strength, depth and sweetness. The staff are also so friendly and hospitable.",restaurant_english_clean_desc
ChIJKQbJbgBd1moRqO1lJp1fyTc,"This was my first time trying Acai bowl. I loved the crunchy oats and nuts. The fruit was also fresh. But can anyone tell me what the black on top is? My friend said her acai bowl had peanut butter, but I didn't see in mine haha | Yummy and healthy smoothie, açai and drinks served by very friendly team of ladies. We enjoyed our short break in green cute deco beverage shop.",restaurant_english_clean_desc
ChIJnRHg-Qld1moRVlRUGMBpybo,"Pared-back Korean grill restaurant with a cocktail menu, tabletop BBQs & a takeaway option.",restaurant_english_clean_desc
ChIJwz2KcctC1moRJw05MBuagLI,Korean share plates & drinks served in a secluded basement with private booths & a wood interior.,restaurant_english_clean_desc
ChIJm4ivjMtC1moRP1C2RftShqU,"Classic breakfasts, snacks and lunches served in roomy, hip cafe with a courtyard, on a uni campus.",restaurant_english_clean_desc
ChIJj4m55RZD1moR9hRun-8v1WU,"A hidden gem in Melbourne CBD! The food is authentic, flavorful, and the portions are generous. Highly recommend the Pad Thai — the balance of spices is just right, not too salty or overly spicy. Prices are reasonable, making it great value for a city location. The atmosphere is casual and welcoming, perfect for a quick lunch, a relaxed dinner, or catching up with friends. Definitely a place I’ll come back to often! | This was our first time dining here. Unfortunately, we were very disappointed. We ordered the Tom Yum Seafood Soup for $35 something. the broth was watery, with very little seafood(mussel is overcooked), and it lacked the bold, flavorful taste we expect from Tom Yum. The spring rolls were also disappointing the wrapper was too thick and not worth it. Overall, the food was overpriced for the quality, and our dinner experience was really sad.but we do hope the restaurant improves their food.",restaurant_english_clean_desc
ChIJXYcRyuFD1moRvE2lHPGz84U,"Have visited this place several times! Nice meal and very good matcha desserts! The staff are quite friendly and the place is always clean and comfy. | Our first visit to Nanas Green Tea, and it couldn’t have been better. With the chilly Melbourne weather outside, we ordered a warm matcha and hot chocolate, both comforting and perfectly balanced. Once warm inside, wr just had to try the matcha parfait. an absolute delight, creamy, rich, and beautifully presented. Everything was brilliant from start to finish, easily making this the best matcha cafe in Melbourne.",restaurant_english_clean_desc
